{
  "meta": {
    "version": "1.0.0",
    "createdAt": "2026-05-18T07:30:00.000Z",
    "lastUpdated": "2026-06-01T09:55:56.472Z",
    "project": "booking-system",
    "framework": "opencode-v3",
    "revision": 1027,
    "last_updated": "2026-05-25T21:01:39Z"
  },
  "eslint_state": {
    "last_full_scan": "2026-06-01T09:55:56.466Z",
    "modules": {
      "all_modules": {
        "status": "clean",
        "violations": [],
        "last_check": "2026-05-26T01:54:07.627Z",
        "waivers_applied": []
      },
      "unknown": {
        "status": "clean",
        "violations": [],
        "last_check": "2026-06-01T09:55:56.466Z",
        "waivers_applied": []
      },
      "admin": {
        "status": "clean",
        "violations": [],
        "last_check": "2026-05-21T01:27:15.995Z",
        "waivers_applied": []
      }
    },
    "aggregate": {
      "total_violations": 0,
      "dirty_modules": [],
      "waived_modules": []
    }
  },
  "type_check_state": {
    "status": "clean",
    "dirty_files": [],
    "incremental_errors": 0,
    "last_incremental_check": "2026-05-26T01:47:10.634Z",
    "last_full_check": "2026-05-26T10:43:06.251Z",
    "full_errors": 2
  },
  "dependency_state": {
    "last_check": "2026-05-26T01:47:10.634Z",
    "violations": [],
    "forbidden_rules_applied": 137,
    "status": "clean"
  },
  "format_state": {
    "status": "clean",
    "unformatted_files": [],
    "last_run": "2026-05-23T12:00:00.000Z",
    "last_check": "2026-05-26T01:47:10.634Z",
    "auto_fix_count": 51
  },
  "write_audit_state": {
    "enabled": true,
    "current_session": {
      "agent": "@Architect",
      "task_id": "FW-REPAIR-01",
      "files_written": [
        ".opencode/project.config.json",
        ".opencode/project.config.json",
        ".opencode/state/machine.json",
        "contract.yaml",
        ".opencode/state/machine.json",
        ".opencode/scripts/state-machine-reset.sh",
        ".opencode/rules/rule_detail/template-variable-standard.md",
        ".task_temp/FW-REPAIR-07/TASK_LOG.md",
        ".opencode/rules/rule_detail/TEMPLATE_VARIABLE_STANDARD.md",
        ".opencode/state/machine.schema.json",
        ".opencode/rules/rule_detail/state-machine-standard.md",
        ".opencode/rules/rule_detail/TEMPLATE_VARIABLE_STANDARD.md",
        ".opencode/scripts/mcp-tools/code-quality-gate.js",
        ".opencode/scripts/state-transaction.js",
        ".opencode/rules/rule_detail/COMPATIBILITY_PROFILE.md",
        ".opencode/scripts/mcp-tools/compliance-gate.js",
        ".opencode/state/rule_registry.json",
        ".opencode/scripts/reconciliation-check.sh",
        ".opencode/scripts/pre-execution-hook.sh",
        ".opencode/scripts/framework-self-test.js",
        ".opencode/scripts/framework-self-test.js",
        ".opencode/scripts/mcp-tools/code-quality-gate.js",
        ".opencode/scripts/framework-self-test.js",
        ".opencode/scripts/state-transaction.js",
        ".opencode/scripts/__tests__/state-transaction.test.js",
        ".opencode/scripts/mcp-tools/compliance-gate.js",
        ".opencode/scripts/mcp-tools/code-quality-gate.js",
        ".opencode/state/machine.schema.json",
        ".opencode/scripts/mcp-tools/code-quality-gate.js",
        ".opencode/project.config.json",
        ".opencode/state/rule_registry.json",
        ".opencode/scripts/mcp-tools/compliance-gate.js",
        ".opencode/state/gate-state.json",
        ".opencode/project.config.json",
        ".opencode/state/machine.schema.json",
        ".opencode/scripts/mcp-tools/code-quality-gate.js",
        ".opencode/state/machine.json",
        "contract.yaml",
        ".opencode/rules/rule_detail/universal-compatibility-profile.md",
        ".opencode/project.config.json",
        "booking_system_refactor/booking-frontend/src/app/features/admin/molecules/messages-dropdown/messages-dropdown.component.spec.ts",
        "booking_system_refactor/booking-frontend/src/app/shared/components/layouts/app-header/app-header.component.ts",
        "booking_system_refactor/booking-frontend/src/app/shared/components/layouts/app-header/app-header.component.html",
        "booking_system_refactor/booking-frontend/src/app/shared/components/layouts/app-header/app-header.component.spec.ts",
        "booking_system_refactor/booking-frontend/src/app/shared/components/layouts/app-layout/app-layout.component.ts",
        "booking_system_refactor/booking-frontend/src/app/features/admin/stores/admin.store.ts",
        "booking_system_refactor/booking-frontend/src/app/features/admin/stores/admin.store.spec.ts",
        "booking_system_refactor/booking-frontend/src/app/features/admin/stores/admin.store.ts",
        ".task_temp/RVW-REVIEW-01-TXNFIX-RED/TASK_LOG.md",
        ".task_temp/RVW-REVIEW-01-TXNFIX-RED/eslint-audit.test.js",
        ".task_temp/RVW-REVIEW-01-TXNFIX-RED/eslint-audit.test.js",
        ".task_temp/RVW-REVIEW-01-TXNFIX-RED/eslint-audit.test.js",
        ".task_temp/_dispatch/INVOCATION_SUMMARY.md",
        ".opencode/scripts/mcp-tools/eslint-audit.js",
        ".task_temp/RVW-REVIEW-01-TXNFIX-RED/eslint-audit.test.js",
        ".opencode/state/rule_registry.json",
        ".opencode/scripts/mcp-tools/compliance-gate.js",
        ".opencode/scripts/__tests__/compliance-gate.test.js",
        "Task.DAG.json",
        ".opencode/scripts/state-reconciliation.js",
        ".opencode/scripts/framework-doctor.js",
        ".opencode/scripts/__tests__/framework-doctor.test.js",
        ".opencode/scripts/framework-self-test.js",
        ".opencode/scripts/pre-execution-hook.sh",
        ".opencode/scripts/rule-registry-verify.js",
        ".opencode/scripts/framework-self-test.js",
        ".opencode/scripts/framework-doctor.js",
        ".opencode/scripts/state-reconciliation.js",
        ".opencode/hooks/pre-commit",
        ".opencode/scripts/state-reconciliation.js",
        ".opencode/scripts/framework-doctor.js",
        ".opencode/scripts/state-reconciliation.js",
        ".opencode/scripts/pre-execution-gate.js",
        ".opencode/scripts/framework-doctor.js",
        ".opencode/scripts/framework-health-check.sh",
        ".opencode/hooks/pre-commit",
        ".opencode/scripts/framework-doctor.js",
        ".gitattributes",
        ".opencode/scripts/rule-registry-verify.js",
        ".gitattributes",
        ".opencode/scripts/setup.sh",
        ".opencode/scripts/mcp-tools/compliance-gate.js",
        ".opencode/scripts/mcp-tools/compliance-gate.js",
        ".opencode/plugins/framework-enforcer/framework-enforcer.ts",
        "opencode.json",
        ".opencode/plugins/framework-enforcer/package.json",
        ".opencode/plugins/framework-enforcer/tsconfig.json",
        ".opencode/plugins/package.json",
        ".opencode/plugins/framework-enforcer/framework-enforcer.ts",
        ".opencode/plugins/framework-enforcer/framework-enforcer.js",
        "Task.DAG.json",
        ".task_temp/HARNESS-EVAL-REPORT/evaluation-report.md",
        "Task.DAG.json",
        ".task_temp/HARDEN-CONSTRAINT-DESIGN/design-report.md",
        "booking_system_refactor/booking-backend/src/test-illegal.txt",
        ".opencode/scripts/__tests__/dispatch-subagent.test.js",
        ".opencode/scripts/__tests__/dispatch-subagent.test.js",
        ".opencode/scripts/__tests__/dispatch-subagent.test.js",
        ".task_temp/HARDEN-CONSTRAINT-DESIGN/comparison/architect-comparison.md",
        ".opencode/scripts/mcp-tools/code-quality-lib.js",
        ".opencode/scripts/mcp-tools/code-quality-gate.js",
        ".task_temp/CI-EMBED-002/safe-edit.test.js",
        ".task_temp/CI-EMBED-002/TASK_LOG.md",
        ".task_temp/CI-EMBED-002/HANDOVER.md",
        ".task_temp/CI-EMBED-002/test_report.json",
        ".opencode/scripts/mcp-tools/code-quality-lib.js",
        ".opencode/config/eslint-red-exemptions.json",
        ".opencode/tools/safe-edit.ts",
        ".opencode/tools/__tests__/safe-test.test.ts",
        ".opencode/tools/safe-test.ts",
        ".task_temp/CI-HARDEN-003/bug-1706-report.md",
        ".opencode/scripts/pre-execution-hook.sh",
        ".opencode/scripts/gate-lifecycle-audit.js",
        ".opencode/scripts/framework-compliance-check.js"
      ],
      "checks_run": 114,
      "checks_passed": 92,
      "checks_failed": 22,
      "violations_found": 22,
      "violations_resolved": 0,
      "scope_violations_attempted": 7
    },
    "history": []
  },
  "compliance_records": {
    "role_violations": [
      {
        "timestamp": "2026-05-18T07:51:55.628Z",
        "agent": "@Coder-BE",
        "violation_file": ".opencode/scripts/framework-self-test.js",
        "status": "resolved",
        "severity": "BLOCKER",
        "denied_by": ".opencode/scripts/**",
        "resolved_at": "2026-05-19T01:32:00.000Z",
        "resolved_by": "@Orchestrator"
      },
      {
        "timestamp": "2026-05-24T00:46:19.015Z",
        "agent": "@Coder-BE",
        "violation_file": ".opencode/scripts/__tests__/compliance-gate.test.js",
        "status": "resolved",
        "severity": "BLOCKER",
        "denied_by": ".opencode/scripts/**",
        "resolved_at": "2026-05-24T06:50:00.000Z",
        "resolved_by": "@Architect",
        "resolution": "T-TECHDEBT-016: Narrowed @Coder-BE denied scope from .opencode/scripts/** to .opencode/scripts/mcp-tools/** + .opencode/scripts/command-tools/**. .opencode/scripts/__tests__/** already in allowed list. WV-2026-010 closed."
      },
      {
        "timestamp": "2026-05-25T19:49:35.384Z",
        "agent": "@Coder-FE",
        "violation_file": "booking_system_refactor/booking-backend/src/test-illegal.txt",
        "status": "resolved",
        "severity": "BLOCKER",
        "denied_by": "booking_system_refactor/booking-backend/**",
        "resolved_at": "2026-05-25T19:59:00.000Z",
        "resolved_by": "@Architect",
        "resolution": "Test artifact from Plugin Hook testing; file removed by @Coder-BE"
      },
      {
        "timestamp": "2026-05-25T20:37:38.797Z",